{
  "$schema": "../packages/architecture-governance/schemas/architecture-registry.schema.json",
  "schemaVersion": 1,
  "repository": "context-action",
  "analysisProjects": [
    {
      "id": "core",
      "root": "packages/core"
    },
    {
      "id": "react",
      "root": "packages/react"
    },
    {
      "id": "example",
      "root": "example"
    },
    {
      "id": "web-coding-demo",
      "root": "demos/bolt-style-editor",
      "fileExtensions": [".ts", ".tsx"]
    },
    {
      "id": "architecture-governance",
      "root": "packages/architecture-governance",
      "fileExtensions": [".cjs", ".js", ".mjs", ".ts", ".tsx"]
    }
  ],
  "policyFiles": [
    "architecture/rules/package-boundaries.json",
    "architecture/rules/impact-boundaries.json"
  ],
  "capabilities": [
    {
      "id": "CA-ACTION-PIPELINE",
      "status": "verified",
      "project": "core",
      "spec": "docs/en/concept/action-pipeline-guide.md",
      "owners": ["packages/core"],
      "implementationAnchors": [
        "packages/core/src/ActionRegister.ts::class::ActionRegister"
      ],
      "testEvidence": [
        "packages/core/__tests__/unit/action-register.lifecycle.test.ts"
      ],
      "publicDocs": [
        "docs/en/concept/action-pipeline-guide.md",
        "docs/ko/concept/action-pipeline-guide.md"
      ],
      "rules": ["CA-PKG-CORE-NO-REACT"]
    },
    {
      "id": "CA-ACTION-CONTEXT",
      "status": "verified",
      "project": "react",
      "spec": "docs/en/examples/action-only.md",
      "owners": ["packages/react"],
      "implementationAnchors": [
        "packages/react/src/actions/ActionContext.tsx::function::createActionContext"
      ],
      "testEvidence": [
        "packages/react/__tests__/actions/createActionContext.test.tsx"
      ],
      "publicDocs": [
        "docs/en/examples/action-only.md",
        "docs/ko/examples/action-only.md"
      ],
      "rules": ["CA-PKG-REACT-REQUIRES-CORE"]
    },
    {
      "id": "CA-STORE-CONTEXT",
      "status": "verified",
      "project": "react",
      "spec": "docs/en/concept/store-conventions.md",
      "owners": ["packages/react"],
      "implementationAnchors": [
        "packages/react/src/stores/patterns/declarative-store-pattern-v2.tsx::function::createStoreContext"
      ],
      "testEvidence": [
        "packages/react/__tests__/stores/patterns/createDeclarativeStorePattern.test.tsx"
      ],
      "publicDocs": [
        "docs/en/examples/store-only.md",
        "docs/ko/examples/store-only.md"
      ],
      "rules": ["CA-PKG-REACT-REQUIRES-CORE"]
    },
    {
      "id": "CA-CONTEXT-LAYERED",
      "status": "verified",
      "project": "example",
      "spec": "docs/en/context-layered/context-layered-guide.md",
      "owners": ["example/src/pages/patterns/layered-architecture"],
      "implementationAnchors": [
        "example/src/pages/patterns/layered-architecture/LayeredArchitecturePage.tsx::function::LayeredArchitecturePage"
      ],
      "testEvidence": [
        "packages/react/__tests__/patterns/implementation-playbook.integration.test.tsx"
      ],
      "publicDocs": [
        "docs/en/context-layered/context-layered-guide.md",
        "docs/ko/context-layered/context-layered-guide.md"
      ],
      "rules": ["CA-SEM-BUSINESS-ISOLATION"]
    },
    {
      "id": "CA-WEB-CODING-STUDIO",
      "status": "verified",
      "project": "web-coding-demo",
      "spec": "docs/en/context-layered/usecase-tool-calling-web-studio.md",
      "owners": ["demos/bolt-style-editor"],
      "implementationAnchors": [
        "demos/bolt-style-editor/src/BoltStyleEditor.tsx::function::BoltStyleEditor",
        "demos/bolt-style-editor/src/workspace-storage.ts::class::WebCodingWorkspaceRepository"
      ],
      "testEvidence": [
        "scripts/verify-web-coding-conventions.mjs",
        "scripts/verify-web-coding-browser.mjs"
      ],
      "publicDocs": [
        "docs/en/context-layered/usecase-tool-calling-web-studio.md",
        "docs/ko/context-layered/usecase-tool-calling-web-studio.md",
        "docs/en/concept/tool-calling-editor-architecture.md",
        "demos/bolt-style-editor/README.md"
      ]
    },
    {
      "id": "CA-ARCH-GOVERNANCE",
      "status": "verified",
      "project": "architecture-governance",
      "spec": "architecture/README.md",
      "owners": ["packages/architecture-governance"],
      "implementationAnchors": [
        "packages/architecture-governance/src/verifier.ts::function::verifyArchitecture"
      ],
      "testEvidence": [
        "packages/architecture-governance/test/verifier.test.mjs",
        "packages/architecture-governance/test/schema.test.mjs"
      ],
      "publicDocs": [
        "architecture/README.md",
        "architecture/governance-guide.md",
        "packages/architecture-governance/README.md",
        "docs/en/context-layered/architecture/architecture-governance.md",
        "docs/ko/context-layered/architecture/architecture-governance.md"
      ],
      "decisions": ["architecture/real-use-review.md"],
      "rules": ["CA-PKG-ARCH-GOVERNANCE-REQUIRES-SEM"]
    }
  ]
}
